{
  "titleNameMap": {
    "educationList": "教育背景",
    "workExpList": "实习经验",
    "projectList": "项目经验",
    "skillList": "专业技能",
    "awardList": "更多信息",
    "workList": "个人作品",
    "aboutme": "个人评价"
  },
  "avatar": {
    "src": "avatars/蒋东海.png",
    "hidden": false
  },
  "profile": {
    "name": "蒋东海",
    "email": "1911792794@qq.com",
    "mobile": "18919597031",
    "github": "",
    "zhihu": "",
    "workExpYear": "",
    "position": "AI Agent 工程师"
  },
  "educationList": [
    {
      "edu_time": [
        "2022.09",
        "2026.07"
      ],
      "school": "西南民族大学",
      "major": "计算机学院",
      "academic_degree": "本科"
    }
  ],
  "awardList": [],
  "workExpList": [
    {
      "company_name": "青软集团",
      "department_name": "后端研发实习生",
      "work_time": [
        "2025.11",
        "2025.12"
      ],
      "work_desc": "项目：基于数字经济的农产品融销数字化平台\n1. 深度参与企业级敏捷开发，负责后端 API 接口开发与第三方支付/认证服务对接\n2. 运用 Spring Boot 配合 Redis 缓存优化热门农产品数据读取逻辑，降低数据库读压力\n3. 掌握华为云线上部署标准流程，积累企业级复杂电商平台的规范化协作与跨部门联调经验"
    },
    {
      "company_name": "某科技企业",
      "department_name": "物联网研发实习生",
      "work_time": [
        "2025.07",
        "2025.07"
      ],
      "work_desc": "1. 参与 IoT 全流程研发，深入学习硬件底层平台，完成传感器数据采集、MQTT 协议对接及物联网云平台联调验证\n2. 独立主导 IoT 项目端到端测试与环境搭建，保障设备数据稳定上报与平台侧功能验收\n3. 获实习单位「领悟力高、执行力强」评价"
    }
  ],
  "skillList": [
    "大模型与 Agent 开发（核心）：熟悉大语言模型（LLM）核心原理与应用场景；熟练掌握 Prompt 工程（Few-shot、CoT 等高级提示技巧）；深入理解 RAG 架构，具备文本智能切块（Chunking）、向量化（Embedding）及本地向量数据库（Chroma/FAISS）实操经验；日常重度使用各类 GenAI 辅助开发工具。",
    "后端工程与数据库：具备扎实的 Java 与 Python 开发功底，深入理解 JVM 内存模型及并发机制；精通 Python+Flask 与 Java/Spring Boot 框架；熟练操作 MySQL，深入理解 B+ 树索引原理，精通复杂 SQL 编写与高并发场景下的索引调优；掌握 Redis 缓存技术。",
    "前端与协作规范：熟练使用 Vue 3 及 Tailwind CSS 构建响应式交互界面，具备全栈开发视野；严格遵循 Git Commit 语义化提交规范与 Commit 拆分原则，保障团队高效协作。",
    "计算机视觉与深度学习：熟练掌握 YOLOv5 目标检测模型的训练与微调（Fine-tuning）；熟练运用 OpenCV 进行图像处理、视频流解析与目标可视化标注；具备完整的深度学习数据集清洗、标注、训练及工程化推理全管线实战经验。"
  ],
  "projectList": [
    {
      "project_name": "线上动物园项目（Ye!ZOO）",
      "project_role": "AI 大模型开发与后端架构",
      "project_time": "2024.09 - 2024.12",
      "project_desc": "集动物数据管理、多维检索与智能化大模型问答于一体的综合动物园服务平台。技术栈：Python+Flask、MySQL、大模型 API（智谱/Gemini）、LangChain、向量数据库、OpenCV。",
      "project_content": "1. RAG 架构智能化升级：主导核心业务 AI 改造，引入大模型 API 将传统检索升级为智能导游；将动物百科、园区混养隔离规则、医疗救助标准等长文本进行 Chunking 与 Embedding 存入本地向量库，打通「用户提问-向量召回-大模型生成」精准问答链路\n2. Prompt 优化与幻觉控制：针对「特定发情期饮食禁忌」等严谨科普场景，设计结构化 System Prompt 并引入 Few-shot 示例，严格限制模型仅基于召回知识库作答，有效遏制模型幻觉\n3. 底层数据库调优：分析海量图文检索瓶颈的执行计划，根据高频查询条件重构 MySQL 联合索引，使高并发下基础数据查询效率提升 30%，为上层 AI 应用奠定稳定数据底座"
    },
    {
      "project_name": "基于 YOLOv5 的目标检测与智能分析工具",
      "project_role": "AI 模型训练与工程落地",
      "project_time": "2025.03 - 2025.05",
      "project_desc": "面向工程化落地的多目标（行人、车辆）实时视觉检测与数据可视化分析工具。技术栈：Python、YOLOv5、OpenCV、LabelImg。",
      "project_content": "1. 负责端到端 AI 训练管线搭建，使用 LabelImg 对公开数据集进行清洗与标准标注，制定严密的数据增强策略以提升模型泛化能力\n2. 基于 YOLOv5 预训练模型完成定制化场景 Fine-tuning，持续调优学习率与 Batch Size 等超参数，使测试集识别准确率稳定在 85% 以上\n3. 编写高并发 Python 推理脚本，利用 OpenCV 构建低延迟视频流读取与动态框选标注管道，将模型能力封装为标准化接口供业务侧调用"
    },
    {
      "project_name": "校园智能点餐小程序",
      "project_role": "全栈开发与高并发处理",
      "project_time": "2025.06 - 2025.12",
      "project_desc": "服务于校园场景的全流程数字化餐饮系统，日均承载千级师生高频访问。技术栈：Java/Spring Boot、Vue 3、Redis、WebSocket、MySQL。",
      "project_content": "1. 负责前后端核心业务流程开发，引入 WebSocket 实现订单状态全链路实时推送，订单更新响应速度提升 40%\n2. 难点攻克：应对多端高并发时，排查并解决接口异常跳转与会话状态不同步问题；通过 Redis 接管分布式会话同步，结合 Vue 3 路由守卫拦截，彻底修复数据不一致底层 Bug\n3. 严格推行语义化代码提交规范，主导编写自动化回归测试脚本，保障系统迭代发版的极高稳定性"
    }
  ],
  "workList": [],
  "aboutme": {
    "aboutme_desc": "本人对 AI Agent 架构、大模型应用（LLM Apps）及底层技术原理抱有极大的热情，具备 Python/Java 扎实的后端工程功底与 AI 模型微调实战经验。目前正在深入探索并搭建本地 RAG 知识库体系，日常重度使用各类 AI 工具辅助研发与自动化测试开发，善于追踪 GenAI 领域的前沿技术。拥有优秀的逆向排障思维与系统架构视野，能够将复杂的业务痛点转化为智能化的大模型工程落地，期待在 AI 应用开发领域持续创造价值。"
  },
  "theme": {
    "id": "blue-minimal",
    "name": "蓝色简约",
    "color": "#1565c0",
    "tagColor": "#42a5f5"
  }
}
